Price,Course Name,Description,Lessons
$20 per session,LEARN SCRATCH PROGRAMING,Scratch Course is the foundation of coding and is a building block of a coding journey. If you want,16 Lessons
$30 per session,LEARN CLOUD COMPUTING BASICS-AWS,"In this course we are going to cover the basics and the most important services on AWS, At the end",20 Lessons
$20 per session,LEARN MOBILE DEVELOPMENT,Mobile application development is the process of creating software applications that run on a mobil,24 Lessons
$20 per session,LEARN CORE JAVA PROGRAMMING ONLINE,"Java is a very popular high-level, class-based, object-oriented programming language that is design",41 Lessons
$20 per session,LEARN ROBOTICS,You can open all kinds of doors for advancement in so many careers with a basic understanding of el,25 Lessons
$20 per session,LEARN JAVASCRIPT,JavaScript is the most popular programming language in the world. It powers the entire modern web.,18 Lessons
$20 per session,LEARN NODE JS,Node.js developers are in high demand and the language is used for everything from traditional web,18 Lessons
$35 per session,LEARN CLOUD COMPUTING ADVANCE-AWS,DESCRIPTION This introduction to cloud computing on Amazon AWS course takes you from the AWS Ad,18 Lessons
$20 per session,PYTHON PROGRAMMING-BEGINNER,"Python is a language with simple syntax, and a powerful set of libraries. It has a rich programming",16 Lessons
$30 per session,Roblox Programming For Beginners,"Explore the dynamic universe of game development with our ""Roblox Game Development Fundamentals"" cou",15 Lessons
$20 per session,PYTHON PROGRAMMING-INTERMEDIATE,Take your python skills to the next level and start building real applications. Python is a pro,16 Lessons
$25 per session,PYTHON PROGRAMMING-ADVANCE,"If you already know Python basics, then this training is the next step in your Python learning path",30 Lessons
$20 per session,PYTHON PROGRAMMING GROUP CLASSES - BEGINNER,"Python is a language with simple syntax, and a powerful set of libraries. It has a rich programming",16 Lessons
$30 per session,Advanced Roblox Scripting Workshop,"""Are you ready to unlock the full potential of your Roblox game development skills? Join our Interme",14 Lessons
$20 per session,Robotics Adventure Awaits:Join Our Summer Camp for Young Tech Wizards!,This course is designed to introduce beginners to the world of robotics. Learners will be taught the,16 Lessons
$20 per session,Java Project-Based Course,Java Project-Based Course for Intermediate Level Students ;Overview: This course is designed for int,7 Lessons
$22 per session,Artificial Intelligence Adventures: Building AI Chatbot Like Chatgpt (For Kids),Unlock the power of AI chatbots in our 10-day course! Gain comprehensive knowledge of chatbot develo,10 Lessons
$20 per session,Python Playground: Create a Hangman Game,Python Playground : Create a Hangman Game is an exciting and engaging course designed specifically f,8 Lessons
$20 per session,Scratch Playground: Create a Maze Game!,Scratch Playground : Create a Maze Game! is a beginner-level course designed to introduce kids to th,8 Lessons
$13 per session,Artificial Intelligence Essentials: Summer Bootcamp,Join us for this engaging 5-day summer bootcamp where we will explore the fascinating world of Artif,5 Lessons
$25 per session,"Time Mastery Camp: AI for Jobs, Business, Careers","The ""AI for Productivity and Time Management"" course: 🚀💡 Day 1: Introduction to AI and its Applica",11 Lessons
$20 per session,Build Your Own Theme Park in Roblox,"Roblox Studio fundamentals are taught through fun and interactive projects. Lectures, projects, hand",8 Lessons
$12 per session,Java Coding Summer Camp for Young Minds,"Java Journey: Coding Camp for Curious Minds"" is a fun-filled, 5-day adventure into the world of prog",5 Lessons
$25 per session,AI Camp for Entrepreneurs: Build Business Success,"Welcome to the world of AI in entrepreneurship! In this course, we will embark on a thrilling journ",7 Lessons
$12 per session,ChatGPT Boot Camp: Basics & Best Uses,Join us for an exciting journey into the world of AI chatbots with this 5-day bootcamp. You'll learn,5 Lessons
$13 per session,Create-A-Bot: A Project-Based Robotics Exploration,"Ignite your child's tech curiosity with our ""RoboRacers"" camp! Over five days, campers will delve in",5 Lessons
$20 per session,Java & Proramming,""" Project outline for JAVA PROJECT BASED BOOTCAMP 1: Introduction to Java and Programming Basics. 2.",8 Lessons
$13 per session,Chatbot Creators: Design a ChatGPT-like AI,Join us on a 7-day bootcamp to step into the world of AI and create your own chatbot like ChatGPT. Y,7 Lessons
$30 per session,Web Development from scratch,"Unlock the boundless potential of web development with our ""Web Development Essentials"" course. Whet",6 Lessons
$11 per session,Summer Camp: Introduction to Python,"Step into our 7-day ""Python Project Playground"" camp where coding meets creativity! Kids will explor",7 Lessons
$22 per session,AI Secrets Revealed: Master Productivity Hacks That Will Blow Your Mind! (For Kids),"Boost your productivity with AI! Join our ""AI for Productivity and Time Management"" course and lea",11 Lessons
$12 per session,"Summer Bootcamp with JavaScript: Real Projects, Real Results","In this 5-day camp, you'll dive headfirst into JavaScript, one of the world's most popular programmi",5 Lessons
$22 per session,AI Disruption: Top Entrepreneurs Harnessing AI for Unprecedented Success! (For Kids),"Understand the role and potential of AI in entrepreneurship, learn the fundamentals, explore data ac",7 Lessons
$22 per session,The AI Writer's Masterclass: Innovation and Inspiration in Creative Writing! (For Kids),Enhance your creative writing skills with AI! Join our 10-day course and explore AI's role in writin,10 Lessons
$30 per session,Web Development Pro: Intermediate Level,"Ready to unlock the full potential of web development? Join our ""Intermediate Web Development Master",8 Lessons
$20 per session,Scratch Playground: Create a Scroller Game!,Scratch Playground : Create a Scroller Game is an intermediate level course designed to teach kids t,8 Lessons
$25 per session,AI Pro: Creative Writing Camp for Adults,🚀 Welcome to Creative Writing with AI for ADULTS! Unleash your creativity with cutting-edge AI tec,10 Lessons
$20 per session,Python Playground: Create Your Own Snake Game,"Through this course, participants will learn the fundamentals of Python programming language, as wel",8 Lessons
$20 per session,Build your own Calculator using Python Bootcamp for kids,This bootcamp is a fun and engaging program designed to introduce children to the basics of programm,8 Lessons
$20 per session,Python Playground: Create a Tic Tac Toe Game,An interactive and hands-on tutorial designed to help learners build their programming skills while,8 Lessons
$20 per session,Scratch Playground: Create a Flappy Bird Game!,Scratch Playground 103: Create a Flappy Bird is a beginner to intermediate level course designed to,8 Lessons
$12 per session,"HTML, CSS, JavaScript: 7-Day Summer Bootcamp","Jump into the vibrant world of coding with our engaging 7-day summer camp! Starting from scratch, yo",7 Lessons
$11 per session,Hands-on Java: Project-based Learning for Coding Novices,"Embark on a coding adventure with our ""Code, Create, Conquer"" Java camp! In just 7 days, kids will l",7 Lessons
$20 per session,Python Playground: Create a Memory Game,Python Playground: Create a Memory Game is a beginner-level course designed for kids who are interes,8 Lessons
$12 per session,Summer Bootcamp: 5-Day Scratch Programming for Beginners,Embark on an exciting coding adventure with our 5-day Scratch Programming camp! Designed for beginne,5 Lessons
$12 per session,5-Day Summer Camp: Python for Beginners,"Dive into coding with our 5-day ""Python Playground"" camp! Kids will explore Python, a popular langua",5 Lessons
$20 per session,Build a Text analyzer using Python Bootcamp for kids,The Build a Text Analyzer using Python Bootcamp for Kids is an educational program designed to intro,8 Lessons
$20 per session,Scratch Playground : Create a Platformer Game!,Scratch Playground : Create a Platformer Game is an intermediate level course designed to teach kids,8 Lessons
$30 per session,Introduction to Artificial Intelligence!,"Welcome to the ""Introduction to Artificial Intelligence and Python"" course! This course is designed",5 Lessons
$20 per session,"Python Playground: Create a Rock, Paper, Scissors Game",This is an engaging course designed for kids who are interested in learning programming with Python.,8 Lessons
$25 per session,AI in Stock Market Success: Career Growth Camp !!,Are you ready to unlock the secrets of predicting stock prices using AI? 📈🤖 Join our immersive cou,10 Lessons
$22 per session,From Beginner to AI Pro: Kickstart Your Journey With Artificial Intelligence! (For Kids),"Dive into the world of AI! 🤖 Join our ""Introduction to Artificial Intelligence"" course and unlock t",20 Lessons
$30 per session,Game development using python,"Welcome to the ""Introduction to Python Game Development"" course! In this course, you'll embark on a",4 Lessons
$20 per session,Build a Image manipulator using Python Bootcamp for kids,The Build a Image Manipulator using Python Bootcamp for Kids is a program designed to introduce chil,8 Lessons
$20 per session,Build a Weather app using Python Bootcamp for kids,Build a Weather App using Python Bootcamp for Kids is an educational program designed to introduce y,8 Lessons
$20 per session,Build Your Own Roblox Battle Arena,"Roblox Studio fundamentals are taught through fun and interactive projects. Lectures, projects, hand",8 Lessons
$22 per session,The Millionaire's AI Playbook: Learn How to Predict Stock Prices! (For Kids),Learn to predict stock prices using the incredible potential of AI and machine learning in our compr,10 Lessons
$11 per session,Machine Learning: 7-Day Project-Based Summer Camp,"Join our ""Machine Learning Mania"" camp for a 7-day tech adventure! Kids will tackle machine learning",7 Lessons
$25 per session,AI Pro Camp: Career Growth Catalyst,Our Intro to AI for Adults course is designed to equip professionals with essential knowledge and pr,20 Lessons
$20 per session,Minecraft Java Programming for Beginners,Session-1: Introduction to Java programming and Minecraft. Lesson 2: Getting Started in Creative Mod,7 Lessons
$20 per session,Build a Chatbot using Python Bootcamp for kids,This bootcamp is a fun and interactive program designed to teach children how to create their own ch,8 Lessons
$20 per session,Build a Password generator using Python Bootcamp for kids,"Welcome to the Build a Password Generator using Python Bootcamp for Kids! In this bootcamp, you will",8 Lessons
$20 per session,Scratch Playground: Create a Space Game!,Scratch Playground : Create a Space Game is an intermediate-level course designed to introduce kids,8 Lessons
$20 per session,Create Your Own Roblox Obstacle Course,Roblox enthusiasts who want to learn how to design and build their own custom obstacle courses withi,8 Lessons
$20 per session,Java Minecraft Creative or Survival Mode,1. Title: Minecraft Java Programming for Beginners Overview: This class is designed for complete beg,7 Lessons
$25 per session,AI Camp for Jobs & Business:Build Your own ChatGPT,🌟Welcome to the Chatbot Mastery Course! 🎓 Get ready to unlock the secrets of building intelligent,10 Lessons
$13 per session,"HTML, CSS, JavaScript Essentials: 5-Day Coding Bootcamp",Unleash your creativity in our fun and interactive 5-day summer camp. No prior experience needed. Yo,5 Lessons
